{
  "$schema": "../schemas/cedros-database-concurrency-contract.v2.schema.json",
  "schemaVersion": 2,
  "contractId": "cedros-data:database-concurrency-v2",
  "capability": {
    "id": "cedros-data:database-concurrency-v2",
    "requiredForProduction": true,
    "detectionPhase": "install-or-readiness",
    "missingBehavior": "block-install-and-activation"
  },
  "compatibility": {
    "currentWitPackage": "cedros:extension@0.1.0",
    "currentGuestBehavior": "conditional-batch-v2",
    "hostUpgradeBehavior": "enforce-before-advertise"
  },
  "supersedes": {
    "contractId": "cedros-data:database-concurrency-v1",
    "immutableOperationIds": [
      "identity.verifications.consume-live-purpose-bound",
      "identity.setup.claim-first-admin",
      "identity.system-admin.demote",
      "organization.membership.change-role",
      "identity.canonical-email.transition",
      "identity.outbox.claim-delivery"
    ]
  },
  "operationSchemaCatalogs": [
    "contracts/host/operations/v2/identity-core.json",
    "contracts/host/operations/v2/identity-auth.json",
    "contracts/host/operations/v2/outbox.json",
    "contracts/host/operations/v2/registration.json",
    "contracts/host/operations/v2/lifecycle.json"
  ],
  "conflictTransport": {
    "legacyMessageFormat": "cedros.db.v1|<unique|precondition|lease>|<operation-id>",
    "categories": ["unique", "precondition", "lease"],
    "httpStatus": 409,
    "clientCode": "resource_conflict",
    "piiAllowed": false
  },
  "uniqueConstraints": [
    {
      "id": "identity.users.normalized-email",
      "accessId": "cedros-login:identity-db",
      "contentModelId": "cedros-login:users",
      "fields": ["email"],
      "normalization": "trim-lowercase",
      "predicate": "email is non-null and non-blank",
      "conflictCategory": "unique"
    },
    {
      "id": "identity.users.username",
      "accessId": "cedros-login:identity-db",
      "contentModelId": "cedros-login:users",
      "fields": ["username"],
      "normalization": "trim-lowercase",
      "predicate": "username is non-null and non-blank",
      "conflictCategory": "unique"
    },
    {
      "id": "identity.users.google-id",
      "accessId": "cedros-login:identity-db",
      "contentModelId": "cedros-login:users",
      "fields": ["googleId"],
      "normalization": "none",
      "predicate": "googleId is non-null and non-blank",
      "conflictCategory": "unique"
    },
    {
      "id": "identity.users.apple-id",
      "accessId": "cedros-login:identity-db",
      "contentModelId": "cedros-login:users",
      "fields": ["appleId"],
      "normalization": "none",
      "predicate": "appleId is non-null and non-blank",
      "conflictCategory": "unique"
    },
    {
      "id": "identity.users.wallet-address",
      "accessId": "cedros-login:identity-db",
      "contentModelId": "cedros-login:users",
      "fields": ["walletAddress"],
      "normalization": "none",
      "predicate": "walletAddress is non-null and non-blank",
      "conflictCategory": "unique"
    },
    {
      "id": "identity.user-emails.normalized-email",
      "accessId": "cedros-login:identity-db",
      "contentModelId": "cedros-login:user-emails",
      "fields": ["email"],
      "normalization": "trim-lowercase",
      "predicate": null,
      "conflictCategory": "unique"
    },
    {
      "id": "identity.user-emails.one-primary",
      "accessId": "cedros-login:identity-db",
      "contentModelId": "cedros-login:user-emails",
      "fields": ["userId"],
      "normalization": "none",
      "predicate": "isPrimary is true",
      "conflictCategory": "unique"
    },
    {
      "id": "organization.orgs.slug",
      "accessId": "cedros-login:org-db",
      "contentModelId": "cedros-login:orgs",
      "fields": ["slug"],
      "normalization": "trim-lowercase",
      "predicate": null,
      "conflictCategory": "unique"
    },
    {
      "id": "organization.memberships.user-org",
      "accessId": "cedros-login:org-db",
      "contentModelId": "cedros-login:memberships",
      "fields": ["userId", "orgId"],
      "normalization": "none",
      "predicate": null,
      "conflictCategory": "unique"
    },
    {
      "id": "organization.invites.pending-email",
      "accessId": "cedros-login:org-db",
      "contentModelId": "cedros-login:invite-records",
      "fields": ["orgId", "email"],
      "normalization": "trim-lowercase",
      "predicate": "acceptedAt is null and email is non-null",
      "conflictCategory": "unique"
    },
    {
      "id": "organization.invites.pending-wallet",
      "accessId": "cedros-login:org-db",
      "contentModelId": "cedros-login:invite-records",
      "fields": ["orgId", "walletAddress"],
      "normalization": "none",
      "predicate": "acceptedAt is null and walletAddress is non-null",
      "conflictCategory": "unique"
    }
  ],
  "conditionalMutations": [
    {
      "id": "identity.verifications.consume-live-purpose-bound", "accessId": "cedros-login:identity-db",
      "contentModelIds": ["cedros-login:verifications"], "atomicity": "single-host-transaction",
      "preconditions": ["live, unused, hash-matching token has an allowed purpose"],
      "mutations": ["consume once and return the pre-mutation payload"], "conflictCategory": "precondition"
    },
    {
      "id": "identity.setup.claim-first-admin", "accessId": "cedros-login:identity-db",
      "contentModelIds": ["cedros-login:users", "cedros-login:user-emails"], "atomicity": "single-host-transaction",
      "preconditions": ["no system administrator exists and normalized email is unclaimed"],
      "mutations": ["create the administrator and canonical email"], "conflictCategory": "precondition"
    },
    {
      "id": "identity.system-admin.demote", "accessId": "cedros-login:identity-db",
      "contentModelIds": ["cedros-login:users"], "atomicity": "single-host-transaction",
      "preconditions": ["revision matches and another administrator remains"],
      "mutations": ["demote and update payload plus host revision transaction time"], "conflictCategory": "precondition"
    },
    {
      "id": "organization.membership.change-role", "accessId": "cedros-login:org-db",
      "contentModelIds": ["cedros-login:memberships"], "atomicity": "single-host-transaction",
      "preconditions": ["revision matches and another owner remains when required"],
      "mutations": ["update or remove membership"], "conflictCategory": "precondition"
    },
    {
      "id": "identity.canonical-email.transition", "accessId": "cedros-login:identity-db",
      "contentModelIds": ["cedros-login:users", "cedros-login:user-emails"], "atomicity": "single-host-transaction",
      "preconditions": ["all revisions match and normalized target is unclaimed"],
      "mutations": ["transition compatibility and canonical email rows"], "conflictCategory": "precondition"
    },
    {
      "id": "identity.outbox.claim-delivery", "accessId": "cedros-login:identity-db",
      "contentModelIds": ["cedros-login:outbox"], "atomicity": "single-host-transaction",
      "preconditions": ["pending due row or sending row with expired lease"],
      "mutations": ["lease, increment attempts, return payload and host revision"], "conflictCategory": "lease"
    },
    {
      "id": "identity.outbox.enqueue-token-email", "accessId": "cedros-login:identity-db",
      "contentModelIds": ["cedros-login:verifications", "cedros-login:outbox"], "atomicity": "single-host-transaction",
      "requiredCapabilityId": "cedros-data:token-email-evidence-v1",
      "preconditions": [
        "verification and outbox ids equal their entry keys and neither row nor the outbox-id receipt exists",
        "verification purpose is one of email_verification, account_email_verify, password_reset, instant_link or account_deletion; token hash is present; createdAt is not in the future; expiresAt is after host transaction time; usedAt is null",
        "verification and outbox user ids match; targetEmail and recipient match case-insensitively",
        "outbox id is a UUID and the row is pending with zero attempts, no provider acceptance, no lease and no preexisting essentialEmailEvidence"
      ],
      "mutations": [
        "atomically create the verification row, create the outbox row with host-issued essentialEmailEvidence, and create one immutable PII-free receipt keyed by the outbox UUID; any conflict rolls back all three"
      ], "conflictCategory": "precondition"
    },
    {
      "id": "identity.outbox.complete-delivery", "accessId": "cedros-login:identity-db",
      "contentModelIds": ["cedros-login:outbox"], "atomicity": "single-host-transaction",
      "preconditions": ["active lease owner and exact host revision match, or exact receipt for the same deliveryId and leaseOwner already exists"],
      "mutations": ["persist idempotent acceptance receipt bound to leaseOwner and delete row"], "conflictCategory": "lease"
    },
    {
      "id": "identity.outbox.release-delivery", "accessId": "cedros-login:identity-db",
      "contentModelIds": ["cedros-login:outbox"], "atomicity": "single-host-transaction",
      "preconditions": ["unexpired lease owner and exact host revision match"],
      "mutations": ["release to pending or failed and return versioned payload"], "conflictCategory": "lease"
    },
    {
      "id": "identity.password-reset.complete", "accessId": "cedros-login:identity-db",
      "contentModelIds": ["cedros-login:verifications", "cedros-login:users", "cedros-login:sessions"], "atomicity": "single-host-transaction",
      "preconditions": ["password-reset proof and user revision match under per-user lock"],
      "mutations": ["consume proof, write password, revoke every session"], "conflictCategory": "precondition"
    },
    {
      "id": "identity.instant-link.complete", "accessId": "cedros-login:identity-db",